{
  "schemaVersion": "1.0.0",
  "configVersion": "valid-enabled",
  "enabled": true,
  "issuedAt": "2026-07-19T00:00:00.000Z",
  "expiresAt": "2099-01-01T00:00:00.000Z",
  "killSwitch": { "engaged": false },
  "privacyProfile": "strict",
  "sampling": { "sessionSampleRate": 0.5, "errorSampleRate": 0.5 },
  "rum": {
    "site": "127.0.0.1:59999",
    "organizationIdentifier": "demo-org",
    "applicationId": "demo-app",
    "clientToken": "fixture client token test value",
    "apiVersion": "v1"
  },
  "browserLogs": { "enabled": false },
  "sessionReplay": { "enabled": false },
  "allowedRoutes": [],
  "allowedSelectors": ["[data-chicek-privacy='mask']"]
}
